ID,Quote,Author,Source,Rating,Tags,Source Type,Notes,Date Added
Q1083,"When you find God in the present moment, you realize that you don't need to seek God. He is with you already.",Eckhart Tolle,Power of Now,5,"God,Spirituality",,,2014-07-01
Q1084,"When listening to another person, don't just listen with your mind, listen with your whole body. Feel the energy field of your inner body as you listen. That takes away from thinking and creates a still space that enables you to truly listen without the mind interfering. You are giving the other person space--space to be. It is the most precious gift you can give.",Eckhart Tolle,Power of Now,5,"Empathy,Listening,Presence",,,2014-07-01
Q1085,"Do not give all your attention away to the mind and the external world. By all means, focus on what you are doing, but feel the inner body at the same time whenever possible. It is almost as if you were reading with listening with your whole body. Stay rooted within.",Eckhart Tolle,Power of Now,5,Presence,,,2014-07-01
Q1086,"If you are drawn to an enlightened teacher, it is because there is already enough presence in you to recognize presence in another. Egos are drawn to bigger egos. Darkness cannot recognize light. Only light can recognize light.",Eckhart Tolle,Power of Now,5,"Light,Mentoring,Teaching",,,2014-07-01
Q1087,"To listen to the silence, wherever you are, is an easy and direct way of becoming present. Even if there is noise, there is always some silence underneath and in between the sounds. Listening to the silence immediately creates a stillness inside you. Only the stillness in you can perceive the silence outside.",Eckhart Tolle,Power of Now,5,"Presence,Silence",,,2014-07-01
Q1088,To complain is always nonacceptance of what is. It invariably carries an unconscious negative charge.,Eckhart Tolle,Power of Now,5,"Acceptance,Complaining",,,2014-07-01
Q1089,"The psychological need to become anything other than who you are already should not be there. Being free of psychological time, you no longer pursue your goals with grim determination driven by fear, anger, discontent, or the need to become someone. You know that nothing real can be threatened.",Eckhart Tolle,Power of Now,5,"Acceptance,Fear",,,2014-07-01
Q1090,Do not be concerned about the fruit of your action--just give attention to the action itself. The fruit will come of its own accord.,Eckhart Tolle,Power of Now,5,Presence,,,2014-07-01
Q1091,Forget about your life situation for a while and pay attention to your life.,Eckhart Tolle,Power of Now,5,"Circumstances,Life",,,2014-07-01
Q1092,"There is no salvation in time. You cannot be free in the future. Presence is the key to freedom, so you can only be free now.",Eckhart Tolle,Power of Now,5,"Presence,Salvation",,,2014-07-01
Q1093,"Focus attention on the feeling inside you. Know that it is the pain-body. Accept that it is there. Donâ€™t think aboutâ€”donâ€™t let the feeling turn into thinking. Donâ€™t judge or analyze. Donâ€™t make an identity for yourself out of it. Stay present, and continue to be the observer of what is happening inside you. Become aware not only of the emotional pain but also of â€œthe one who observes,â€_x009d_ the silent watcher. This is the power of the Now, the power of your own conscious presence. Then see what happens next.",Eckhart Tolle,Power of Now,5,"Acceptance,Presence",,,2014-07-01
Q1094,"Whatever the present moment contains, accept it as if you had chosen it. Always work with it, not against it. Make it your friend and ally, not your enemy. This will miraculously transform your whole life.",Eckhart Tolle,Power of Now,5,"Acceptance,Presence",,,2014-07-01
Q1095,"Pleasure is always derived from something outside you, wheras joy arises from within. The very thing that gives you pleasure today will give you pain tomorrow, or it will leave you, so its absence will give you pain.",Eckhart Tolle,Power of Now,5,"Joy,Pleasure",,,2014-07-01
Q1096,"The beginning of freedom is the realization that you are not the possessing entity--the thinker. Knowing this enables you to observe the entity. The moment you start watching the thinker, a higher level of consciousness becomes activated. You begin to realize that all the things that truly matter--beauty, love, creativity, joy, inner peace--arise from beyond the mind. You begin to awaken.",Eckhart Tolle,Power of Now,5,"Depression,Presence",,,2014-07-01
Q1097,Success is a lousy teacher. It seduces smart people into thinking they can't lose.,Bill Gates,Power Mentoring,5,"Experience,Failure,Success",,,2014-07-01
Q1098,"Success is the result of what sociologists like to call """"accumulative advantage."""" Because we so profoundly personalize success, we miss opportunties to life others onto the top rung.",Malcom Gladwell,Outliers,5,"Charity,Service,Success",,,2014-07-01
Q1099,It's hard to think independently once you have heard the opinions of the institutional elite.,Mitt Romney,No Apology,5,"Independence,Thinking",,,2014-07-01
Q1100,"There is nothing wrong with wanting to be the best in the world, as long as you remember that doing so also means wanting to be the best for the world.",Keith Ferazzi,Never Eat Alone,5,"Aspirations,Pride,Purpose",,,2014-07-01
Q1101,"To this day, I face rejection on a regular basis. If you're going to be creative, cutting edge, out of the mainstream, you'd better get used to rockin' the boat. Passion keeps you going through the rough times come hell or high water, and both will come.",Keith Ferazzi,Never Eat Alone,5,"Embarrassment,Failure,Rejection",,,2014-07-01
Q1102,Stop driving yourself--and everyone else--crazy thinking about how to make yourself successful. Start thinking about how you're going to make everyone around you successful.,Keith Ferazzi,Never Eat Alone,5,"Business,Career,Selfishness",,,2014-07-01
Q1103,Every human is an opportunity to help and be helped.,Keith Ferazzi,Never Eat Alone,5,"Interactions,Service",,,2014-07-01
Q1104,"Selling is, reduced to its essence, solving another person's problems.",Keith Ferazzi,Never Eat Alone,5,"Business,Sales",,,2014-07-01
Q1105,A goal is a dream with a deadline.,Keith Ferazzi,Never Eat Alone,5,"Dreams,Goals",,,2014-07-01
Q1106,"There is no such thing as a """"self-made"""" man. We are made up of thousands of others. Everyone who has ever done a kind deed for us, or spoken one word of encouragement to us, has entered into the make-up of our character and of our thoughts, as well as our success.",George Burton Adams,Never Eat Alone,5,"Influence,Pride,Success",,,2014-07-01
Q1107,"On the most profitable lie, the course of events presently lays a destructive tax.",Ralph Waldo Emerson,Nature and Other Essays,5,"Dishonesty,Integrity",,,2014-07-01
Q1108,"The reason why we feel one man's presence, and do not feel another's, is as simple as gravity. Truth is the summit of being; justice is the application of it to affairs. All individual natures stand in a scale, according to the purity of character in them.",Ralph Waldo Emerson,Nature and Other Essays,5,"Character,Countenance,Presence",,,2014-07-01
Q1109,"I think all Christians would agree with me if I said that though Christianity seems at first to be all about morality, all about duties and rules and guilt and virtue, yet it leads you on, out of that into something beyond: to a point where they are not thinking about it. They are too busy looking at the source from which it comes.",C.S. Lewis,Mere Christianity,5,"Christianity,Guilt,Religion",,,2014-07-01
Q1110,"If you have really handed yourself over to Him, it must follow that you are trying to obey Him. But trying in a new way, a less worried way. Not doing these things in order to be saved, but because he has begun to save you already. Not hoping to get to Heaven as a reward for your actions, but inevitably wanting to act in a certain way because a first faint gleam of Heaven is already inside of you.",C.S. Lewis,Mere Christianity,5,"Obedience,Religion",,,2014-07-01
Q1111,"Now Faith, is the art of holding on to things your reason has once accepted, in spite of your changing moods. Consequently one must train the habit of Faith, else he will just be a creature dithering to and fro, with his beliefs really dependent on the weather and the state of his digestion.",C.S. Lewis,Mere Christianity,5,"Faith,Reason",,,2014-07-01
Q1112,"Most people, if they had really learned to look into their own hearts, would know that they do want, and want acutely, something that cannot be had in this world.",C.S. Lewis,Mere Christianity,5,"Purpose,Spirituality",,,2014-07-01
Q1113,Aim at Heaven and you will get earth thrown in: aim at earth and you will get neither.,C.S. Lewis,Mere Christianity,5,"Spirituality,Worldliness",,,2014-07-01
Q1114,"Do not waste time bothering whether you love your neighbor; act as if you did. As soon as we do this we find one of the great secrets. When you are behaving as if you loved someone, you will presently come to love him.",C.S. Lewis,Mere Christianity,5,Love,,,2014-07-01
Q1115,We might thing that God wanted simply obedience to a set of rules: whereas He really wants people of a particular sort.,C.S. Lewis,Mere Christianity,5,"Character,Obedience",,,2014-07-01
Q1116,The truth is that right actions done for the wrong reason do not help build the internal quality or character of virtue--but it is this character that really matters.,C.S. Lewis,Mere Christianity,5,"Character,Conformity,Virtue",,,2014-07-01
Q1117,"Pleasure is, and must remain, a side-effect or by-product, and is destroyed and spoiled to the degree to which it is made a goal in itself.",Victor Frankl,Man's Search For Meaning,5,Pleasure,,,2014-07-01
Q1118,"Our current mental-hygeine philosophy stresses the idea that people ought to be happy, that unhappiness is a system of maladjustment. Such a value system might be responsible for the fact that the burden of unavoidable unhappiness is increased by unhappiness about being unhappy.",Victor Frankl,Man's Search For Meaning,5,Happiness,,,2014-07-01
Q1119,When we are no longer able to change a situation--just think of an incurable disease such as inoperable cancer--we are challenged to change ourselves.,Victor Frankl,Man's Search For Meaning,5,"Attitude,Circumstances,Freedom",,,2014-07-01
Q1120,"Once the meaning of suffering had been revealed to us, we refused to minimize or alleviate the camp's tortures by ignoring them or harboring false illusions and entertaining artificial optimism. Suffering had become a task on which we did not want to turn our backs. We had realized its hidden opportunities for achievement.",Victor Frankl,Man's Search For Meaning,5,"Experience,Optimism,Suffering",,,2014-07-01
Q1121,"The last of the human freedoms--to choose one's attitude in any given set of circumstances, to choose one's own way. Even under such circumstances, man can decide what shall become of him--mentally and spiritually.",Victor Frankl,Man's Search For Meaning,5,"Attitude,Experience,Freedom,Suffering",,,2014-07-01
Q1122,Live as if you were to die tomorrow. Learn as if you were to live forever.,Gandhi,iPhone,5,"Knowledge,Learning",,,2014-07-01
Q1123,"Whenever people stop actively learning and growing, the clock has started ticking down to a time when they will no longer have anything left to give",John C. Maxwell,iPhone,5,nan,,,2014-07-01
Q1124,I look for employees who are thoughtful of the ledger and mindful of the baby,Stanley Marcus,iPhone,5,nan,,,2014-07-01
Q1125,"Businesses thrive on agility, speed, passion, and alignment",Forbes,iPhone,5,nan,,,2014-07-01
Q1126,The greatest leaders are the greatest followers.,Elder Stephen Owen,iPhone,5,nan,,,2014-07-01
Q1127,"In the Church of God, questions are honered, opposition is not.",Elder Dallin H. Oaks,iPhone,5,nan,,,2014-07-01
Q1128,The most important single ingredient for success is knowing how to get along with people.,Theodore Roosevelt,iPhone,5,nan,,,2014-07-01
Q1129,I don’t want you to spend the rest of your life being average at what you are bad at. I want you to become great at what you are good at.,Roy Spence,iPhone,5,nan,,,2014-07-01
Q1130,"A prophet does not stand between you and the Savior. Rather, he stands beside you and points the way to the Savior",Neil Anderson,iPhone,5,nan,,,2014-07-01
Q1131,"If grass were to stiffen tall in an attempt to resist the strong winds, it would likely break in two. Be as free as the grass and flow with acceptance.",Zach Stanford,iPhone,5,Acceptance,,,2014-07-01
Q1132,What seems but trivial conversation to you may be of vast importance to another.,Zach Stanford,iPhone,5,"Conversation,Listening,Relationships",,,2014-07-01
Q1133,Optimism isn't a futuristic expectation that things will get better; it is embracing the present moment and loving what is.,Zach Stanford,iPhone,5,"Acceptance,Optimism",,,2014-07-01
Q1134,Arrogance may cause you to appear more charismatic but it doesn't inspire trust.,Zach Stanford,iPhone,5,"Pride,Trust",,,2014-07-01
Q1135,A life of too much ease and too much freedom will likely be reminisced with feelings of emptiness. Sacrifice and suffering give our lives substance.,Zach Stanford,iPhone,5,"Sacrifice,Suffering",,,2014-07-01
Q1136,"It is futile for a man to spend his days trying to find himself. If man's core is love, he will never truly find himself by looking inside himself. Love can only be actualized by giving it to another first.",Zach Stanford,iPhone,5,"Love,Purpose",,,2014-07-01
Q1137,You can display all the confidence in the world without coming across as prideful if you make sure to show an equal amount of willingness and desire to learn from others.,Zach Stanford,iPhone,5,"Confidence,Humility,Pride",,,2014-07-01
Q1138,"Desiring to become a person of virtue tends to be a better motivator than trying to overcome your vices. As it goes, turning on the light is more effective than trying to push the darkness out.",Zach Stanford,iPhone,5,"Character,Motivation,Virtue",,,2014-07-01
Q1139,"Far too many fall into normalacy by forfeiting their independence of mind too soon. They let their church, their friends, and society mold them before ever finding out who they really are. Those who are great are not creations of others--they have created themselves.",Zach Stanford,iPhone,5,"Greatness,Independence",,,2014-07-01
Q1140,Independent soul searching is prerequisite to passionate selfless ministry.,Zach Stanford,iPhone,5,"Independent Thinking,Selflessness",,,2014-07-01
Q1141,"Before you can figuratively step into someone else's shoes, you must fully step out of your own. You can't experience true empathy if you are being biased by your own opinions and experience.",Zach Stanford,iPhone,5,"Empathy,Listening,Understanding",,,2014-07-01
Q1142,Someone who stops speaking is not necessarily done talking. Interrupting a person's train of thought is just as rude as interrupting his voice.,Zach Stanford,iPhone,5,"Conversation,Listening",,,2014-07-01
Q1143,We must develop the capacity to see men not as they are at present but as they may become.,Thomas S. Monson,iPhone,5,"Influence,Judgment",,,2014-07-01
Q1144,"Forgiveness comes from some other place. It's not something that we manufacture. We can create the conditions under which forgiveness can appear an we hope it will appear, but we can't control true forgiveness.",Thomas Moore,iPhone,5,Forgiveness,,,2014-07-01
Q1145,"Grant me the strength to accept things I cannot change, the courage to change the things I can, and the wisdom to know the difference.",St. Francis,iPhone,5,"Acceptance,Wisdom",,,2014-07-01
Q1146,"There is only one good, knowledge; there is only one evil, ignorance.",Socrates,iPhone,5,"Ignorance,Knowledge",,,2014-07-01
Q1147,The unexamined life is not worth living.,Socrates,iPhone,5,"Introspection,Life,Purpose",,,2014-07-01
Q1148,"The true intellectual is one whose intellect is sufficiently developed that he recognizes not only the great potential, but also the limitations of his intellectual capacity. The most learned people are those who find no inconsistency between study and faith and who have achieved proficiency in both.",Rex E. Lee,iPhone,5,"Faith,Intelligence,Reason",,,2014-07-01
Q1149,"Man has within him an inherent love of virtue and duty. To be sure, a man seeks some of the advantages of virtue. But one of the advantages of virtue is that it makes the soul superior to what an evil man calls advantages, and fills the heart with the love of God's law. There is no elevated mind that does not feel that virtue is it's own reward.",Ralph Waldo Emerson,iPhone,5,"Character,Greatness,Virtue,Worldliness",,,2014-07-01
Q1150,"To be sure, a man seeks some of the advantages of virtue. But one of the advantages of virtue is that it makes the soul superior to what an evil man calls advantages, and fills the heart with the love of God's law.",Ralph Waldo Emerson,iPhone,5,"Blessings,Virtue",,,2014-07-01
Q1151,What lies behind us and what lies before us are tiny matters compared to what lies within us.,Ralph Waldo Emerson,iPhone,5,"Potential,Self-worth",,,2014-07-01
Q1152,Life is a succession of lessons which must be lived to be understood.,Ralph Waldo Emerson,iPhone,5,"Experience,Life,Wisdom",,,2014-07-01
Q1153,Loneliness is a time when we feel separate from all. Solitude is a time when we feel deeply connected to self,Psychology Today,iPhone,5,"Introspection,Loneliness,Solitude",,,2014-07-01
Q1154,"Truly happy people seem to have an intuitive grasp of the fact that sustained happiness is not just about doing things that you like. Happy people, are, simply put, curious.",Psychology Today,iPhone,5,"Adventure,Curiosity,Happiness",,,2014-07-01
Q1155,"If you want to come up with a creative solution, you need to think about the problem in a new way. Don't focus on finding a creative solution, look for another way to describe the situation.",Psychology Today,iPhone,5,"Creativity,Problem-solving",,,2014-07-01
Q1156,Battling boredom thwarts serendipity. 'Wasted' moments are the ones in which we often unconsciously connect the dots. The value of unfilled time is one many must work to appreciate.,Psychology Today,iPhone,5,"Boredom,Creativity,Problem-solving,Solitude",,,2014-07-01
Q1157,What we do in life echoes in the eternities.,Maximus,iPhone,5,"Choices,Courage,Greatness",,,2014-07-01
Q1158,We must rapidly begin the shift from a 'thing-oriented' society to a 'person-oriented' society.,"Martin Luther King, Jr.",iPhone,5,"Love,Selflessness,Service,Worldliness",,,2014-07-01
Q1159,Never ruin an apology with an excuse.,Kimberly Johnson,iPhone,5,"Apologies,Excuses",,,2014-07-01
Q1160,"We often talk about people with great memories as if they have a gift -- but that is not the case. We remember, when we pay attention. We remember, when we are deeply engaged. We remember, when we are able to take information and to figure out why it is meaningful to us.",Joshua Foer,iPhone,5,"Attention,Memory",,,2014-07-01
Q1161,"The four cardinal virtues are prudence, justice, fortitude, and temperance. The three theological virtues are faith, hope, and love.",Joseph Pieper,iPhone,5,"Character,Virtue",,,2014-07-01
Q1162,"The seven deadly sins are lust, gluttony, greed, sloth, wrath, envy, and pride.",Joseph Pieper,iPhone,5,"Character,Sins",,,2014-07-01
Q1163,"When truth shall touch the cords of your heart, they will vibrate; then intelligence shall illuminate your mind, and shed its luster in your soul, and you shall begin to understand the things you once knew, but which had gone from you; you shall begin to understand and know the object of your creation.",John Taylor,iPhone,5,"Knowledge,Testimony,Truth",,,2014-07-01
Q1164,Those who are average look to stay in their comfort zone. Those who are great look to get out of their comfort zone.,Jeff Pickett,iPhone,5,"Courage,Greatness",,,2014-07-01
Q1165,The most accomplished performers have defined specific rituals where as those who are less successful do not.,James E. Loehr,iPhone,5,"Habits,Success,Visualization",,,2014-07-01
Q1166,"To be a man, a boy must see a man.",J R Moehringer,iPhone,5,"Influence,Manliness,Mentoring",,,2014-07-01
Q1167,"I had no shoes and complained, until I met a man who had no feet.",Indian Proverb,iPhone,5,"Complaining,Optimism",,,2014-07-01
Q1168,God loves us more than he loves our happiness.,Gordon B. Hinckley,iPhone,5,"Experience,Happiness,Trials",,,2014-07-01
Q1169,"In the moment when I truly understand my enemy, understand him well enough to defeat him, then in that very moment I also love him. I think it's impossible to really understand somebody, what they want, what they believe, and not love them the way they love themselves.",Ender Wiggin,iPhone,5,"Empathy,Enemies,Love,Understanding",,,2014-07-01
Q1170,The world needs more inspiration and less information.,Elain Witt,iPhone,5,"Inspiration,Speaking,Teaching",,,2014-07-01
Q1171,Reading without reflection is like eating without digestion.,Edmund Burke,iPhone,5,"Introspection,Reading,Thinking",,,2014-07-01
Q1172,"A belief may be comforting. Only through your own experience, however, does it become liberating.",Eckhart Tolle,iPhone,5,"Belief,Experience",,,2014-07-01
Q1173,"Most of what people have to say about God and the higher spiritual worlds has involved bringing them down to our level, rather than elevating our perceptions up to theirs.",Eben Alexander,iPhone,5,"God,Perspective,Spirituality",,,2014-07-01
Q1174,Expecting the world to treat you fairly because you are a good person is a little like expecting a bull not to charge at you because you are a vegetarian.,David Wholey,iPhone,5,"Fairness,Trials",,,2014-07-01
Q1175,Looking at small advantages prevents great affairs from being accomplished.,Confucius,iPhone,5,"Goals,Integrity,Perspective,Self-control",,,2014-07-01
Q1176,"The hearing that is only in the ears is one thing. The hearing in the mind is another. But the hearing of the spirit is not limited to any one faculty, to the ear, or to the mind. Hence it demands the emptiness of all the faculties. And when the faculties are empty, then the whole being listens. There is then a direct grasp of what is right there before you that can never be heard with the ear or understood with the mind.",Chuang-Tzu,iPhone,5,"Empathy,Listening,Understanding",,,2014-07-01
Q1177,"It is it is Christ himself, not the Bible, who is the true word of God. The Bible, read in the right spirit and with the guidance of good teachers, will bring us to Him.",C.S. Lewis,iPhone,5,"Christianity,Faith,Scriptures",,,2014-07-01
Q1178,The pain I feel now is the happiness I felt before.,C.S. Lewis,iPhone,5,"Regret,Sin,Tempation",,,2014-07-01
Q1179,"All you then have to do is to keep out of his mind the question """"If I, being what I am, can consider that I am in some sense a Christian, why should the different vices of those people in the next pew prove that their religion is mere hypocrisy and convention?",C.S. Lewis,iPhone,5,"Hypocrisy,Judgment",,,2014-07-01
Q1180,True humility is not thinking less of yourself; it is thinking less about yourself.,C.S. Lewis,iPhone,5,"Humility,Pride",,,2014-07-01
Q1181,"I believe in Christianity as I believe the sun had risen: not only because I see it, but because by it I see everything else.",C.S. Lewis,iPhone,5,"Christianity,Faith",,,2014-07-01
Q1182,"Emotions cycle in and cycle out. The key is to embrace them, but not attach to them. Verbally acknowledge them. Say, this is what anger feels like, this is what sadness feels like, this is what love and happiness feels like.",Buddhist Podcast,iPhone,5,"Acceptance,Emotions,Meditation,Presence,Sadness",,,2014-07-01
Q1183,All that we are is the result of what we have thought.,Buddha,iPhone,5,"Character,Thoughts",,,2014-07-01
Q1184,Holding on to anger is like grasping a hot coal with the intent of throwing it at someone else; you are the one getting burned.,Buddha,iPhone,5,Anger,,,2014-07-01
Q1185,Religion has gone from a belief of faith and mystery to certainty. I'm right you're wrong -- shut up.,Brene Brown,iPhone,5,"Ignorance,Religion,Testimony",,,2014-07-01
Q1186,Don't fake it till you make it. Fake it till you become it.,Amy Cuddy,iPhone,5,"Perserverence,Self-improvement",,,2014-07-01
Q1187,I do not like that man. I must get to know him better.,Abraham Lincoln,iPhone,5,"Judgment,Kindness,Understanding",,,2014-07-01
Q1188,"I used to think that if you cared for other people, you need to study sociology or something like it. But, I concluded, if you want to help other people, be a manager. If done well, management is among the most noble of professions.",Clayton Christensen,How Will You Measure Your Life?,5,"Business,Influence,Leadership,Management",,,2014-07-01
Q1189,The deepest principle in human nature is the craving to be appreciated. It is this urge that differentiates us from the animals. It is this urge that has been responsible for civilization itself.,William James,How to Win Friends & Influence People,5,"Appreciation,People,Praise",,,2014-07-01
Q1190,"There's magic in the phrase: """"I may be wrong. Let's examine the facts.",Dale Carnegie,How to Win Friends & Influence People,5,"Conflict,Humility,Persuasion",,,2014-07-01
Q1191,"It struck me so forcibly that I shall never forget him. He had qualities which I had never seen in any other man. Never had I seen such concentrated attention. There was none of that piercing 'soul penetrating gaze' business. His eyes were mild and genial. His voice was low and kind. His gestures were few. But the attention he gave me, his appreciation of what I said, even when I said it badly, was extraordinary. You've no idea what it meant to be listened to like that.",Dale Carnegie,How to Win Friends & Influence People,5,"Appreciation,Attention,Conversation,Empathy,Listening",,,2014-07-01
