ID,Quote,Author,Source,Rating,Tags,Source Type,Notes,Date Added
Q1489,"The word 'God' has become empty of meaning through thousands of years of misuse. By misuse, I mean that people who have never even glimpsed the realm of the sacred, the infinite vastness behind that word, use it with great conviction as if they know what they are talking about. The important question is whether the word is a help or a hindrance in enabling you to experience That towards which it points. Does it point beyond itself to that transcendental reality, or does it lend itself too easily to becoming no more than an idea in your head that you believe in, a mental idol?",Eckhart Tolle,Power of Now,4,"God,Religion",,,2014-07-01
Q1490,"Young people will often have an older person in the organization to look after them in their early years to ensure that their careers are off to a good start. Out of these relationships it is hoped that young people learn to take risks, accept a philosphical commitment to sharing, and learn to relate to people in an intuitive empathic way.",Harvard Business Review,Power Mentoring,4,"Career,Mentoring",,,2014-07-01
Q1491,Success is a function of persistence and doggedness and the willingness to work hard for twenty-two minutes to make something that most people would give up on after thirty seconds.,Malcom Gladwell,Outliers,4,"Patience,Persistence,Success",,,2014-07-01
Q1492,"If you work hard enough and assert yourself, and use your mind and imagination, you can shape the world to your desires.",Malcom Gladwell,Outliers,4,"Success,Work",,,2014-07-01
Q1493,"Hard work is a prison sentence only if it does not have meaning. Once it does, it becomes the kind of thing that makes you grab your wife around the waist and dance a jig.",Malcom Gladwell,Outliers,4,"Complaining,Work",,,2014-07-01
Q1494,"Vitality drains out of conversations when we lose connection with the feelings and needs generating the speaker's words, and with the requests associated with those needs. Instead of being engaged in an exchange of life energy with other human beings, we see ourselves becoming wastebaskets for their words.",Marshall B. Rosenberg,Nonviolent Communication,4,"Connection,Conversation,Empathy",,,2014-07-01
Q1495,"When I concentrated on listening for his feelings and needs, I stopped seeing him as a monster.",Marshall B. Rosenberg,Nonviolent Communication,4,"Listening,Understanding",,,2014-07-01
Q1496,"When someone really hears you without passing judgment on you, without trying to take responsibility for you, without trying to mold you, it feels damn good!",Carl Rogers,Nonviolent Communication,4,"Empathy,Judgment,Listening",,,2014-07-01
Q1497,"Our souls are not hungry for fame, comfort, wealth, or power. Those rewards create almost as many problems as they solve. Our soulds are hungry for meaning, for the sense that we have figured out how to live so that our lives matter so the world will at least be a little bit different for our having passed through it.",Rabbi Harold Kushner,Never Eat Alone,4,"Fame,Meaning,Purpose",,,2014-07-01
Q1498,"Creativity in business is often nothing more than making connections that everyone else has almost thought of. You don't have to reinvent the wheel, just attach it to a new wagon.",Mark McCormack,Never Eat Alone,4,Creativity,,,2014-07-01
Q1499,"Stand out! Style matters. Whether you like it or not, clothing, letterheads, hairstyles, business cards, office spaces, and conversational styles are noticed--big time. The design of your brand is critical.",Keith Ferazzi,Never Eat Alone,4,"Business,Career,Style",,,2014-07-01
Q1500,"If what you do can be done by anyone, there will always be someone willing to do it for less.",Keith Ferazzi,Never Eat Alone,4,Skills,,,2014-07-01
Q1501,"Every conversation you have is an invitation to risk revealing the real you. What's the worst that can happen? They don't respond in kind. So what. They probably weren't worth knowing in the first place. But if the risk pays off, well, now you've just turned a potentially dull exchange into something interesting or even perhaps personally insightful--and more times than not, a real relationship is formed.",Keith Ferazzi,Never Eat Alone,4,"Authenticity,Conversation,Vulnerability",,,2014-07-01
Q1502,"When we are truly passionate about something, it's contagious. Our passion draws other people to who we are and what we care about. Shared interests are the basic building blocks of any relationship.",Keith Ferazzi,Never Eat Alone,4,"Friendship,Passion",,,2014-07-01
Q1503,"Friendship is created out of the quality of time spent between two people, not the quantity.",Keith Ferazzi,Never Eat Alone,4,Friendship,,,2014-07-01
Q1504,Reaching out to others is not a numbers game. Your goal is to make genuine connections with people you can count on.,Keith Ferazzi,Never Eat Alone,4,Networking,,,2014-07-01
Q1505,"Most people haven't figured out that it's better to spend more time with fewer people at a one-hour get-together, and have one or two meaningful dialogues, than engage in the wandering-eye routine and lose the respect of most of the people you meet.",Keith Ferazzi,Never Eat Alone,4,Networking,,,2014-07-01
Q1506,"The choice isn't between success and failure; it's between choosing risk and striving for greatness, or risking nothing and being certain of mediocrity.",Keith Ferazzi,Never Eat Alone,4,"Risk,Success",,,2014-07-01
Q1507,Our achievements grow according to the size of our dreams and the degree to which we are in touch with our mission.,Keith Ferazzi,Never Eat Alone,4,"Dreams,Introspection,Success",,,2014-07-01
Q1508,Real networking is about finding ways to make other people more successful. It is about working hard to give more than you get. It is always better to give before you receive.,Keith Ferazzi,Never Eat Alone,4,Networking,,,2014-07-01
Q1509,"Trust men, and they will be true to you; treat them greatly and they will show themselves great.",Ralph Waldo Emerson,Nature and Other Essays,4,"Influence,Trust",,,2014-07-01
Q1510,"It is disgraceful to fly to events for confirmation of our truth and worth. The real victory is celebrated by serenity, which is joy fixed or habitual.",Ralph Waldo Emerson,Nature and Other Essays,4,"Self-worth,Serenity",,,2014-07-01
Q1511,"This is that which we call Character--a reserved force which acts directly by presence, and without means. It is conceived of as a certain undemonstrable force, a Familiar or Genius, by whose impulses a man is guided, but whose counsels he cannot impart; which is company for him, so that such men are often solitary, or if they chance to be social, do not need society, but can entertain themselves very well alone.",Ralph Waldo Emerson,Nature and Other Essays,4,"Character,Solitude",,,2014-07-01
Q1512,"I know nothing which life has to offer so satisfying as the profound good understanding, which can subsit, after much exchange of good offices, between two virtuous men, each whom is sure of himself, and sure of his friend.",Ralph Waldo Emerson,"My Friend, My friend",4,"Friendship,Trust",,,2014-07-01
Q1513,"What is so delicious as a just and firm encounter of two, in a thought, in a feeling? How beautiful, on their approach to this beating heart, the steps and forms of the gifted and the true! The moment we indulge our affections, the earth is metamorphosed.",Ralph Waldo Emerson,"My Friend, My friend",4,Friendship,,,2014-07-01
Q1514,"Friendship may be said to require natures so rare and costly, each so well tempered and so happily adapted, and withal so circumstanced, that when it occurs, a union is created that lasts forever. It is in the hope of attaining this state that every man passes his life in the search after friendship.",Ralph Waldo Emerson,"My Friend, My friend",4,Friendship,,,2014-07-01
Q1515,"If you picture Time as a straight line along which we have to travel, then you must view God as the whole page on which the line is drawn. God, from above or outside or all round, contains the whole line, and sees it all. He has infinite attention to spare for each one of us. You are as much alone with Him as if you were the only being He had every created.",C.S. Lewis,Mere Christianity,4,"God,Infinity",,,2014-07-01
Q1516,"Daily praying and religious reading and churchgoing are necessary parts of the Christian life, because we have to be continually reminded of what we believe. Neither this belief nor any other will automatically remain alive in the mind. It must be fed.",C.S. Lewis,Mere Christianity,4,"Faith,Prayer,Scriptures",,,2014-07-01
Q1517,"There is no need to be worried by facetious people who try to make the Christian hope of Heaven ridiculous by saying they do now want to spend eternity playing harps. The answer to such people is that if they cannot understand books written for grown-ups, they should not talk about them. All the scriptural imagery (harps, crowns, gold, etc.) is, of course, a merely symbolic attempt to express the inexpressible. People who take these symbols literally might as well think that when Christ told us to be like doves, He meant that we were to lay eggs.",C.S. Lewis,Mere Christianity,4,"Ignorance,Symbolism",,,2014-07-01
Q1518,Good and evil both increase at compound interest. The smallest good act today is the capture of a strategic point; while an apparently trivial indulgence in lust or anger today is the loss of a ridge or railway line.,C.S. Lewis,Mere Christianity,4,"Actions,Behavior,Consistency",,,2014-07-01
Q1519,"It is the comparison that makes a man proud. Once the element of competition has gone, pride has gone.",C.S. Lewis,Mere Christianity,4,Pride,,,2014-07-01
Q1520,"Every one says forgiveness is a lovely idea, until they have someone or something to forgive.",C.S. Lewis,Mere Christianity,4,Forgiveness,,,2014-07-01
Q1521,"Being as harmless as doves and as wise as serpents means having a child's heart, but a grown-up's head.",C.S. Lewis,Mere Christianity,4,"Character,Wisdom",,,2014-07-01
Q1522,"Here is another thing that used to puzzle me. Is it not frightfully unfair that this new life should be confined to people who have heard of Christ and been able to believe in Him? We don't know God's plans. But in the meantime, if you are worried about the people outside, the most unreasonable thing you can do is to remain outside yourself.",C.S. Lewis,Mere Christianity,4,"Fairness,Gospel",,,2014-07-01
Q1523,"I am trying to prevent anyone saying the really foolish thing that people often say about Him: """"I'm ready to accept Jesus as a great moral teacher; but I don't accept His claim to be God."""" You must make your choice. Either this man was, and is, the Son of God: or else a madman or something worse.",C.S. Lewis,Mere Christianity,4,Jesus Christ,,,2014-07-01
Q1524,"Reality, in fact, is usually something you could not have guessed. That is one of the reasons I believe Christianity. It is a religion you could not have guessed. If it offered us just the kind of universe we had always expected, I should feel we were making it up. But, in fact, it is not the sort of thing anyone would have made up. It has just that queer twist about it that real things have.",C.S. Lewis,Mere Christianity,4,"Christianity,Faith",,,2014-07-01
Q1525,The Moral Law tells us the tune we have to play: our instincts are merely the keys.,C.S. Lewis,Mere Christianity,4,"Morality,Obedience",,,2014-07-01
Q1526,"It became easy to overlook the opportunities to make something positive of camp life, opportunities which really did exist. People forget that often it is just such an exceptionally difficult external situation which gives man the opportunity to grow spiritually beyond himself.",Victor Frankl,Man's Search For Meaning,4,Trials,,,2014-07-01
Q1527,"Emotion, which is suffering, ceases to be suffering as soon as we form a clear and precise picture of it.",Victor Frankl,Man's Search For Meaning,4,Suffering,,,2014-07-01
Q1528,The attempt to develop a sense of humor and to see things in a humorous light is some kind of trick learned while mastering the art of living.,Victor Frankl,Man's Search For Meaning,4,Humor,,,2014-07-01
Q1529,Happiness is not something you postpone for the future; it is something you design for the present.,Zig Ziglar,iPhone,4,"Happiness,Presence",,,2014-07-01
Q1530,Readily agreeing with negative feedback is just another form of defensiveness.,Zach Stanford,iPhone,4,Feedback,,,2014-07-01
Q1531,"Beware of isolating when conversing in a group. All it takes is a simple, yet equally distributed, glance to each person present.",Zach Stanford,iPhone,4,"Conversation,Kindness",,,2014-07-01
Q1532,I find it exciting when I don't understand a generally well-accepted quote for it reminds me that I have yet many life lessons to learn and experience.,Zach Stanford,iPhone,4,Quotes,,,2014-07-01
Q1533,The best teacher is the one who is able to take a simple subject and create a profound classroom discussion by asking deeply thought-provoking questions.,Zach Stanford,iPhone,4,Teaching,,,2014-07-01
Q1534,Being realistic is the most commonly traveled road to mediocrity.,Will Smith,iPhone,4,"Dreams,Greatness",,,2014-07-01
Q1535,"Your job should not be the most important thing in your life. The key to a successful and happy life is balance. Your job is part of that balance, but only a part. Make time for your family and friends - and for yourself.",Steve Burke,iPhone,4,"Balance,Career,Family,Job",,,2014-07-01
Q1536,"Trusting your intuition means tuning in as deeply as you can to the energy you feel, following that energy moment to moment, trusting that it will lead you where you want to go and bring you everything you desire.",Shakti Gawain,iPhone,4,Intuition,,,2014-07-01
Q1537,"For some people, the longing to be popular far outweighs the longing to be respected, and their social media accounts can verify this.",Paul Hiebert,iPhone,4,"Popularity,Respect,Social Media",,,2014-07-01
Q1538,The best way to have a good idea is to have a lot of ideas.,Linus Pauling,iPhone,4,"Creativity,Ideas",,,2014-07-01
Q1539,"If you are drawn to an enlightened teacher, it is because there is already enough presence in you to recognize presence in another. Egos, however, are drawn to false teachers. Darkness cannot recognize light. Only light can recognize light.",Eckhart Tolle,iPhone,4,"Countenance,Mentoring,Presence",,,2014-07-01
Q1540,The homemaker has the ultimate career. All other careers exist for one purpose -- and that is to support the ultimate career.,C.S. Lewis,iPhone,4,"Mothers,Women",,,2014-07-01
Q1541,I can't imagine a man really enjoying a book and reading it only once.,C.S. Lewis,iPhone,4,Reading,,,2014-07-01
Q1542,"Meditation is used to let go of sensual desires, anger, laziness, restlessness, boredom, and doubt. Once these are let go, the mind is concentrated, and the world is clearer than ever.",Buddhist Podcast,iPhone,4,Meditation,,,2014-07-01
Q1543,"The greatest good you can do for another is not just to share your riches, but to reveal to him his own.",Benjamin Disraeli,iPhone,4,"Influence,Mentoring,Service",,,2014-07-01
Q1544,Find a job you love and you love and you'll never work a day in your life.,Clayton Christensen,How Will You Measure Your Life?,4,"Business,Career,Work",,,2014-07-01
Q1545,"Indeed, while experiences and information can be good teachers, there are many times in life where we simply cannot afford to learn on the job. You don't want to have to go through multiple marriages to learn how to be a good spouse. Or wait until your last child has grown to master parenthood. That is why theory can be so valuable: it can explain what will happen, even before you experience it.",Clayton Christensen,How Will You Measure Your Life?,4,"Experience,Learning",,,2014-07-01
Q1546,"Every man I meet is my superior in some way. In that, I learn of him.",Ralph Waldo Emerson,How to Win Friends & Influence People,4,"Interactions,Respect",,,2014-07-01
Q1547,"People who can put themselves in the place of other people, who can understand the workings of their minds, need never worry about what the future has in store for them.",Owen D. Young,How to Win Friends & Influence People,4,"Empathy,Success,Understanding",,,2014-07-01
Q1548,"Many people fail to make a favorable impression because they don't listen attentively. They have been so much concerned with what they are going to say next that they do not keep their ears open. Very important people have told me that they prefer good listeners to good talkers, but the ability to listen seems rarer than almost any other good trait.",Issac F. Marcosson,How to Win Friends & Influence People,4,"Likability,Listening",,,2014-07-01
Q1549,Talk about your own mistakes before criticizing the other person.,Dale Carnegie,How to Win Friends & Influence People,4,"Criticism,Feedback",,,2014-07-01
Q1550,"And so I had him thinking of me as a good conversationalist when, in reality, I had been merely a good listener and had encouraged him to talk.",Dale Carnegie,How to Win Friends & Influence People,4,"Conversation,Listening",,,2014-07-01
Q1551,A person's name is to that person the sweetest and most important sound in any language.,Dale Carnegie,How to Win Friends & Influence People,4,Interactions,,,2014-07-01
Q1552,"Criticism is futile because it puts a person on the defensive and usually makes him strive to justify himself. Criticism is dangerous, because it wounds a person's precious pride, hurts his sense of importance, and arouses resentment.",Dale Carnegie,How to Win Friends & Influence People,4,"Criticism,Feedback",,,2014-07-01
Q1553,A man without a smiling face must not open shop.,Chinese Proverb,How to Win Friends & Influence People,4,"Business,Happiness,Smiling",,,2014-07-01
Q1554,"I have yet to find a person, however great or exalted his station, who did not do better work and put forth greater effort under a spirit of approval than he would ever do under a spirit of criticism.",Charles Schwab,How to Win Friends & Influence People,4,"Criticism,Feedback",,,2014-07-01
Q1555,"Hatred is never ended by hatred, but by love.",Buddha,How to Win Friends & Influence People,4,"Hate,Love",,,2014-07-01
Q1556,"A sharp saw always cuts faster and better, and we must never be too busy to sharpen ours.",Stephen R. Covey,How to Succeed with People,4,"Maintenance,Rest",,,2014-07-01
Q1557,He did each thing as if he did nothing else.,Charles Dickens,How Successful People Think,4,"Effort,Focus",,,2014-07-01
Q1558,A Level 5 leader is an individual who blends extreme personal humility with intense professional will.,Jim Collins,Good to Great,4,"Humility,Leadership",,,2014-07-01
Q1559,People and companies that suffer from the curse of competence rarely become great.,Jim Collins,Good to Great,4,"Greatness,Potential",,,2014-07-01
Q1560,"I've come to believe that any serious attempt to cultivate the moral and spiritual dimensions of life will begin to generate and nourish growing suspicions of something more, that something more to which religious faith is both a response and a call.",Thomas V. Morris,God and the Philosophers,4,"Faith,Religion",,,2014-07-01
Q1561,I am a Christian because the deep resources of Christian theology resonate with and make sense of both the contours of my experience and the lineaments of my thoughts.,Thomas V. Morris,God and the Philosophers,4,Christianity,,,2014-07-01
Q1562,"It is clear to me that it is not just discrete and dramatic, extraordinary experiences of a limited duration and a memorable nature that function in one's coming to have and then both maintaining and maturing in a religious world view--but it seems to me that the job has been done in my own life primarily by a lot of little experiences, insights, intuitions, feelings, adumbrations, and convictions I have sensed forming within myself.",Thomas V. Morris,God and the Philosophers,4,"Faith,Testimony",,,2014-07-01
Q1563,"Men must measure their esteem of each other by what each is, and not by what each has.",Ralph Waldo Emerson,Essay on Self-Reliance,4,Character,,,2014-07-01
Q1564,"Say to them that threaten your independence: O father, O mother, O wife, O friend, I have lived with you after your appearances hitherto. Henceforward I am the truth's. Be it known unto you that henceforward I obey no law less than the eternal law. I will have no covenants but proximities. I shall endeavor to nourish my parents to support my family, to be the chaste husband of one wife,--but these relations I must fill after a new and unprecedented way. I appeal from your customs. I must be myself. I cannot break myself any longer for you. If you can love me for what I am, we shall be the happier. If you cannot, I will still seek to deserve that you should. I will not hide my tastes or aversions. I will so trust that what is deep is holy, that I will do strongly before the sun and moon whatever inly rejoices me, and the heart appoints. If you are noble, I will love you; if you are not, I will not hurt you and myself by hypocritical attentions. I fyou are true, but not in the same truth with me, cleave to your companions; I will seek my own. I do this not selfishly, but humbly and truly. It is alike your interest, and mine, and all men's however long we have dwelt in lies, to live in truth. Does this sound harsh today? You will soon love what is dictated by your nature as well as mine, and, if we follow the truth, it will bring us out safe at last.",Ralph Waldo Emerson,Essay on Self-Reliance,4,Creeds,,,2014-07-01
Q1565,"Good and bad are but names very readily transferable to that or this; the only right is what is after my constitution, the only wrong what is against it.",Ralph Waldo Emerson,Essay on Self-Reliance,4,"Belief,Truth",,,2014-07-01
Q1566,Whoso would be a man must be a nonconformist. Nothing is at last sacred but the integrity of your own mind.,Ralph Waldo Emerson,Essay on Self-Reliance,4,"Belief,Independence,Self-reliance",,,2014-07-01
Q1567,Trust thyself; every heart vibrates to that iron string.,Ralph Waldo Emerson,Essay on Self-Reliance,4,"Belief,Introspection",,,2014-07-01
Q1568,"I do then with my friends as I do with my books. I would have them where I can find them, but I seldom use them. We must have society on our own terms, and admit or exclude it on the slightest cause. I cannot afford to speak too much with my friend. If he is great, he makes me so great that I cannot descend to converse.",Ralph Waldo Emerson,Essay on Friendship,4,Friendship,,,2014-07-01
Q1569,"It is foolish to be afraid of making our ties too spiritual, as if so we could lose any genuine love.",Ralph Waldo Emerson,Essay on Friendship,4,Friendship,,,2014-07-01
Q1570,"The higher the style we demand of friendship, of course the less easy to establish it with flesh and blood. We walk alone in the world. Friends, such as we desire, are dreams and fables.",Ralph Waldo Emerson,Essay on Friendship,4,"Friendship,Independence",,,2014-07-01
Q1571,"Wait, and thy heart shall speak. Wait until the necessary and everlasting overpowers you, until day and night avail themselves of your lips. The only reward of virtue is virtue; the only way to have a friend is to be one. You shall not come nearer a man by getting into his house. If unlike, his soul only flees the faster from you, and you shall never catch a true glance of his eye.",Ralph Waldo Emerson,Essay on Friendship,4,"Friendship,Patience",,,2014-07-01
Q1572,"Friendship demands a religious treatment. We talk of choosing our friends, but friends are self-elected. Reverence is a great part of it. Treat your friend as a spectacle.",Ralph Waldo Emerson,Essay on Friendship,4,"Friendship,Respect",,,2014-07-01
Q1573,"Let this friendship be an alliance of two large, formidable natures, mutually beheld, mutually feared, before yet they recognize the deep identity which beneath these disparities unites them.",Ralph Waldo Emerson,Essay on Friendship,4,"Connection,Friendship",,,2014-07-01
Q1574,"We are to dignify our friend the daily needs and offices of man's life, and embellish it by courage, wisdom, and unity. Our friendship should never fall into something usual and settled, but should be alert and inventive, and add rhyme and reason to what was drudgery.",Ralph Waldo Emerson,Essay on Friendship,4,"Friendship,Influence",,,2014-07-01
Q1575,I hate the prostitution of the name of friendship to signify modish and worldly alliances.,Ralph Waldo Emerson,Essay on Friendship,4,Friendship,,,2014-07-01
Q1576,"Let us approach our friend with an audacious trust in the truth of his heart, in the breadth, impossible to be overturned, of his foundations.",Ralph Waldo Emerson,Essay on Friendship,4,"Friendship,Loyalty,Trust",,,2014-07-01
Q1577,"Almost all people descend to meet. All association must be a compromise, and, what is worst, the very flower and aroma of the flower of each of the beautiful natures disappears as they approach each other. What a perpetual disappointment is actual society, even of the virtuous and gifted!",Ralph Waldo Emerson,Essay on Friendship,4,"Authenticity,Conversation,Friendship",,,2014-07-01
Q1578,"We are what we repeatedly do. Excellence, then, is not an act, but a habit.",Aristotle,Energy Addict,4,"Character,Habits,Success",,,2014-07-01
Q1579,"If you have a 10-horsepower motor and you subject it to a 12-horsepower load, it will burn out. But when you have a human body that is the equivalent of a 10-horsepower motor and you subject it to a 12-horsepower load, it eventually becomes a 12-horsepower motor.",Lawrence Golding,Encyclopedia of Bodybuilding,4,Bodybuilding,,,2014-07-01
Q1580,"Until we can receive with an open heart, we are never really giving with an open heart. When we attach judgment to receiving help, we knowingly or unknowingly attach judgment to giving help.",Brene Brown,Daring Greatly,4,Gratitude,,,2014-07-01
