ID,Quote,Author,Source,Rating,Tags,Source Type,Notes,Date Added
Q001,Perserverence and spirit have done wonders in all ages.,George Washington,1776,3,Perserverence,,,2016-01-01
Q002,"Washington was not a brilliant strategist or tactician, not a gifted orator, not an intellectual. At several crucial moments he had shown marked indecisiveness. He had made serious mistakes in judgment. But experience had been his great teacher from boydhood, and in this his greatest test, he learned steadily from experience. Above all, Washington never forgot what was at stake and he never gave up.",David McCullough,1776,5,Experience,,,2016-01-01
Q003,"On Washington: There was no hint of arrogance. Amiable, modest, and dignified were words frequently used to describe him, and there was a softness in his eyes that people remembered. Yet he had a certain distance in manner that set him off from, or above, others. He had learned to comport himself with perfect manners and polish.",David McCullough,1776,5,Humility,,,2016-01-01
Q004,"We want great men who, when fortune frowns, will not be discouraged.",Colonel Henry Knox,1776,4,Adversity,,,2016-01-01
Q005,"10 powerful phrases for positive people:
 1. I'm wrong. 
 2. I'm sorry.
 3. You can do it.
 4. I believe in you.
 5. I'm proud of you.
 6. Thank you.
 7. I need you.
 8. I trust you.
 9. I respect you.
 10. I love you.",Rich DeVos,10 Powerful Phrases for Positive People,4,Optimism,,,2016-01-01
Q006,The secret to running faster is to run farther.,Matt Fitzgerald,80/20 Running,,Running,,,2016-01-01
Q010,"Ralph Roberts to the Board of Directors: 'You want me to criticize Mr. Gallagher, but I'm not going to do it. The franchise is not as important to me as this young man.",William Novak,An Incredible Dream - Comcast,,Forgiveness,,,2016-01-01
Q011,"When one of the nicest people on the planet is also a very tough businessman, that's a rare and effective combination.",William Novak,An Incredible Dream - Comcast,4,Business,,,2016-01-01
Q012,"Even when Ralph was angry, he never raised his voice. And in the rare cases when he did show anger, it seemed more like disappointment.",William Novak,An Incredible Dream - Comcast,4,Anger,,,2016-01-01
Q013,"When Ralph greets you in the middle of a food court or a crowded convention, he gives you his full attention, without ever looking around to see who else is in the room. He really listens to what you're saying. You can see it in his eye contact and in his gestures, and you can tell it comes from his heart.",William Novak,An Incredible Dream - Comcast,5,Conversation,,,2016-01-01
Q014,"Ralph promised himself that if he were ever in a leadership position, he would remember how wonderful it feels when the boss knows who you are.",William Novak,An Incredible Dream - Comcast,5,Leadership,,,2016-01-01
Q015,"Ralph Roberts didn't view leadership as being all that complicated, and when it was, he made it look easy. He ran Comcast from various places within himself--his head, his heart, his gut, and especially his personality, which was relaxed, collaborative, and generous on the surface, with a tough and more aggressive layer hidden underneath.",William Novak,An Incredible Dream - Comcast,5,Leadership,,,2016-01-01
Q016,"It's a paradox that often points to success, and also to leadership--the man with superb social skills who enjoys and appreciates his fellow human beings, but does not need them to be self-sufficient.",William Novak,An Incredible Dream - Comcast,5,Independence,,,2016-01-01
Q017,"The strong calm man is always loved and revered. That exquisite poise of character which we call serenity is the fruitage of the soul. It is precious as wisdom, more to be desired than gold--yea, than even fine gold.",James Allen,As A Man Thinketh,4,Poise,,,2016-01-01
Q018,Calmness of mind is one of the beautiful jewels of wisdom.,James Allen,As A Man Thinketh,5,Wisdom,,,2016-01-01
Q019,The greatest achievement was at first and for a time a dream. The oak sleeps in the acorn; the bird waits in the egg; and in the highest vision of the soul a waking angel stirs. Dreams are the seedlings of realities.,James Allen,As A Man Thinketh,4,Achievement,,,2016-01-01
Q020,"There can be no progress, no achievement without sacrifice.",James Allen,As A Man Thinketh,3,Sacrifice,,,2016-01-01
Q021,He who has conquered doubt and fear has conquered failure.,James Allen,As A Man Thinketh,4,Failure,,,2016-01-01
Q022,"Having conceived of his purpose, a man should mentally mark out a straight pathway to its achievement, looking neither to the right nor to the left. Doubts and fears should be rigorously excluded; they are disintegrating elements which break up the straight line of effort, rendering it crooked, ineffectual, useless.",James Allen,As A Man Thinketh,3,Fear,,,2016-01-01
Q023,"Men are anxious to improve their circumstances, but are unwilling to improve themselves.",James Allen,As A Man Thinketh,3,Self-improvement,,,2016-01-01
Q024,"When a man earnestly applies himself to remedy the defects in his character, and makes swift and marked progress, he passes rapidly through a succession of vicissitudes.",James Allen,As A Man Thinketh,5,Character,,,2016-01-01
Q025,"Thought and character are one, and as character can only manifest and discover itself through environment and circumstance, the outer conditions of a person's life will always be found to be harmoniously related to his inner state.",James Allen,As A Man Thinketh,4,Character,,,2016-01-01
Q026,"A noble and Godlike character is not a thing of favor or chance, but is the natural result of continued effort in right thinking, the effect of long-cherished association with Godlike thoughts.",James Allen,As A Man Thinketh,4,Character,,,2016-01-01
Q027,"I grew convinced that truth, sincerity, and integrity in dealings between man and man were of the utmost importance to the felicity of lifeâ€¦Revelation had, indeed, no weight with me as such; but I entertained an opinion that, though certain actions might not be bad because they were forbidden by it, or good because it commanded them, yet probably those actions might be forbidden because they were bad for us, or commanded because they were beneficial to us, in their own natures.",Benjamin Franklin,Autobiography of Benjamin Franklin,5,Truth,,,2016-01-01
Q028,"I cannot boast of much success in acquiring the reality of humility, but I had a good deal with regard to the appearance of it. I made it a rule to forbear all direct contradiction to the sentiments of others, and all positive assertion of my own. I soon found the advantage of this change in my manner; the conversations I engaged in went on more pleasantly.",Benjamin Franklin,Autobiography of Benjamin Franklin,5,Communication,,,2016-01-01
Q029,"It was about this time I conceived the bold an arduous project of arriving at moral perfection. I wished to live without committing any fault at any time; I would conquer all that either natural inclination, custom, or company might lead me into.",Benjamin Franklin,Autobiography of Benjamin Franklin,4,Perfection,,,2016-01-01
Q030,"Influence upon the private character, late in life, is not only an influence late in life, but a weak influence. It is in youth that we plant our chief habits and prejudices.",Benjamin Franklin,Autobiography of Benjamin Franklin,5,Habits,,,2016-01-01
Q031,"The more men have to lose, the less willing are they to venture. The rich are in general slaves to fear.",Thomas Paine,Common Sense,4,Money,,,2016-01-01
Q032,"Of more worth is one honest man to society and in the sight of God, than all the crowned ruffians that ever lived.",Thomas Paine,Common Sense,4,Integrity,,,2016-01-01
Q033,"Well, when one has no one, nowhere else one can go! Do you understand, sir, do you understand what it means when you have absolutely nowhere to turn? For every man must have somewhere to go.",Fyodor Dostoyevsky,Crime and Punishment,4,Love,,,2016-01-01
Q034,"It is not the critic who counts; not the man who points out how the strong man stumbles, or where the doer of deeds could have done better. The credit belongs to the man who is actually in the arena, whose face is marred by dust and sweat and blood; who strives valiantly; who errs, who comes short again and again. It is he who at the best knows in the end the triumph of high achievement, and who at the worst, if he fails, at least fails while daring greatly.",Theodore Roosevelt,Daring Greatly,5,Courage,,,2016-01-01
Q035,"Until we can receive with an open heart, we are never really giving with an open heart. When we attach judgment to receiving help, we knowingly or unknowingly attach judgment to giving help.",Brene Brown,Daring Greatly,4,Gratitude,,,2016-01-01
Q036,There's a crack in everything. That's how the light gets in.,Brene Brown,Daring Greatly,4,Experience,,,2016-01-01
Q037,"We either own our stories (even the messy ones), or we stand outside of them--denying our vulnerabilities and imperfections, orphaning the parts of us that don't fit in with who/what we think we're supposed to be, and hustling for other people's approval of our worthiness.",Brene Brown,Daring Greatly,4,Confidence,,,2016-01-01
Q038,"Vulnerability is not oversharing or purging; rather, it is sharing our feelings and experiences with people who have earned the right to hear them.",Brene Brown,Daring Greatly,4,Conversation,,,2016-01-01
Q039,"Vulnerability is the birthplace of love, belonging, joy, courage, empathy, and creativity. It is the source of hope, empathy, accountability, and authenticity. If we want greater clarity in our purpose or deeper and more meaningful spiritual lives, vulnerability is the path.",Brene Brown,Daring Greatly,4,Purpose,,,2016-01-01
Q040,"Connection is why we're here. We are hardwired to connect with others, it's what gives purpose and meaning to our lives, and without it there is suffering.",Brene Brown,Daring Greatly,4,Connection,,,2016-01-01
Q041,"When we stop caring about what people think, we lose our capacity for connection. When we become defined by what people think, we lose our willingness to be vulnerable. If we dismiss all the criticism, we lose out on important feedback, but if we subject ourselves to the hatefulness, our spirits get crushed. It's a tightrope, shame resilience is the balance bar, and the safety net below is the one or two people in our lives who can help us reality-check the criticism and cynicism.",Brene Brown,Daring Greatly,5,Connection,,,2016-01-01
Q042,"Empathy is a strange and powerful thing. There is no script. There is no right way or wrong way to do it. It's simply listening, holding space, withholding judgment, emotionally connecting, and communicating that incredibly healing message of 'You're not alone.",Brene Brown,Daring Greatly,,Connection,,,2016-01-01
Q043,"Three stages of growth: aspiration, adversity, achievement.",Ryan Holiday,Ego is the Enemy,,Growth,,,2016-01-01
Q044,"Learning to quiet the ego will help us to be humble in our aspirations, gracious in our success, resilient in our failures.",Ryan Holiday,Ego is the Enemy,,Humility,,,2016-01-01
Q045,"If you have a 10-horsepower motor and you subject it to a 12-horsepower load, it will burn out. But when you have a human body that is the equivalent of a 10-horsepower motor and you subject it to a 12-horsepower load, it eventually becomes a 12-horsepower motor.",Lawrence Golding,Encyclopedia of Bodybuilding,4,Running,,,2016-01-01
Q046,The most accomplished performers have defined specific rituals in daily life where as those who are less successful do not.,James E. Loehr,Energy Addict,5,Success,,,2016-01-01
Q047,"We are what we repeatedly do. Excellence, then, is not an act, but a habit.",Aristotle,Energy Addict,4,Character,,,2016-01-01
Q048,"I do then with my friends as I do with my books. I would have them where I can find them, but I seldom use them. We must have society on our own terms, and admit or exclude it on the slightest cause. I cannot afford to speak too much with my friend. If he is great, he makes me so great that I cannot descend to converse.",Ralph Waldo Emerson,Essay on Friendship,4,Friendship,,,2016-01-01
Q049,"It is foolish to be afraid of making our ties too spiritual, as if so we could lose any genuine love.",Ralph Waldo Emerson,Essay on Friendship,4,Friendship,,,2016-01-01
Q050,"The higher the style we demand of friendship, of course the less easy to establish it with flesh and blood. We walk alone in the world. Friends, such as we desire, are dreams and fables.",Ralph Waldo Emerson,Essay on Friendship,4,Friendship,,,2016-01-01
Q051,"Wait, and thy heart shall speak. Wait until the necessary and everlasting overpowers you, until day and night avail themselves of your lips. The only reward of virtue is virtue; the only way to have a friend is to be one. You shall not come nearer a man by getting into his house. If unlike, his soul only flees the faster from you, and you shall never catch a true glance of his eye.",Ralph Waldo Emerson,Essay on Friendship,4,Friendship,,,2016-01-01
Q052,"Friendship demands a religious treatment. We talk of choosing our friends, but friends are self-elected. Reverence is a great part of it. Treat your friend as a spectacle.",Ralph Waldo Emerson,Essay on Friendship,4,Friendship,,,2016-01-01
Q053,"Let this friendship be an alliance of two large, formidable natures, mutually beheld, mutually feared, before yet they recognize the deep identity which beneath these disparities unites them.",Ralph Waldo Emerson,Essay on Friendship,4,Connection,,,2016-01-01
Q054,"We are to dignify our friend the daily needs and offices of man's life, and embellish it by courage, wisdom, and unity. Our friendship should never fall into something usual and settled, but should be alert and inventive, and add rhyme and reason to what was drudgery.",Ralph Waldo Emerson,Essay on Friendship,4,Friendship,,,2016-01-01
Q055,"Let us buy our entrance to this guild by a long probation. Why should we desecrate noble and beautiful souls by intruding on them? Why insist on rash personal relations with your friend? Why go to his house, or know his mother and brother and sisters? Why be visited by him at your own? Are these things material to our covenant? Leave this touching and clawing. Let him be to me a spirit. A message, a thought, a sincerity, a glance from him, I want, but not news, nor pottage. I can get politics and chat, and neighborly conveniences from cheaper companions.",Ralph Waldo Emerson,Essay on Friendship,5,Friendship,,,2016-01-01
Q056,"Let him not cease an instant to be himself. The only joy I have in his being mine, is that the not mine is mine. I hate, where I looked for a manly furtherance, or at least a manly resistance, to find a mush of concession. Better be a nettle in the side of your friend than his echo.",Ralph Waldo Emerson,Essay on Friendship,5,Authenticity,,,2016-01-01
Q057,"I find the law of one to one peremptory for conversation, which is the practice and consummation of friendship. Do not mix waters too much. You shall have very useful and cheering discourse at several times with two several men, but let all three of you come together, and you shall not have one new and hearty word. Two may talk and one may hear, but three cannot take part in a conversation of the most sincere and searching sort.",Ralph Waldo Emerson,Essay on Friendship,5,Connection,,,2016-01-01
Q058,"Every man alone is sincere. At the entrance of a second person, hypocrisy begins.",Ralph Waldo Emerson,Essay on Friendship,5,Authenticity,,,2016-01-01
Q059,"A friend is a person with I may be sincere. Before him I may think aloud. I am arrived at last in the presence of a man so real and equal, that I may drop even those undermost garments of dissimulation, courtesy, and second thought, which men never put off, and may deal with him with the simplicity and wholeness with which one chemical meets another.",Ralph Waldo Emerson,Essay on Friendship,5,Authenticity,,,2016-01-01
Q060,There are two elements that go to the composition of friendship. One is sincerity and the other is tenderness.,Ralph Waldo Emerson,Essay on Friendship,5,Friendship,,,2016-01-01
Q061,"I do not wish to treat friendship daintily, but with the roughest courage. When they are real, they are not glass threads or frostwork, but the solidest thing we know. The sweet sincerity of joy and peace, which I draw from this alliance with my brother's soul, is the nut itself, whereof all nature and all thought is but the husk and shell.",Ralph Waldo Emerson,Essay on Friendship,5,Authenticity,,,2016-01-01
Q062,"The laws of friendship are austere and eternal, of one web with the laws of nature and of morals. But we have aimed at a swift and petty benefit, to suck a sudden sweetness. We snatch at the slowest fruit in the whole garden of God, which many summers and many winters must ripen. We seek our friend not sacredly, but with an adulterate passion which would appropriate him to ourselves. In vain.",Ralph Waldo Emerson,Essay on Friendship,5,Friendship,,,2016-01-01
Q063,"What is so delicious as a just and firm encounter of two, in a thought, in a feeling? How beautiful, on their approach to this beating heart, the steps and forms of the gifted and the true! The moment we indulge our affections, the earth is metamorphosed; there is no winter, and no night; all tragedies, all ennuis, vanish,--all duties even; nothing fills the proceeding eternity but the forms all radiant of beloved persons.",Ralph Waldo Emerson,Essay on Friendship,5,Connection,,,2016-01-01
Q064,Nothing can bring you peace but yourself. Nothing can bring you peace but the triumph of principles,Ralph Waldo Emerson,Essay on Self-Reliance,5,Character,,,2016-01-01
Q065,"Men must measure their esteem of each other by what each is, and not by what each has.",Ralph Waldo Emerson,Essay on Self-Reliance,4,Character,,,2016-01-01
Q066,"Every great man is unique. Insist on yourself. Your own gift you can present every moment with the cumulative force of a whole life's cultivation; but of the adopted talent of another, you have only an extemporaneous, half-possession.",Ralph Waldo Emerson,Essay on Self-Reliance,5,Independence,,,2016-01-01
Q067,"Say to them that threaten your independence: O father, O mother, O wife, O friend, I have lived with you after your appearances hitherto. Henceforward I am the truth's. Be it known unto you that henceforward I obey no law less than the eternal law. I will have no covenants but proximities. I shall endeavor to nourish my parents to support my family, to be the chaste husband of one wife,--but these relations I must fill after a new and unprecedented way. I appeal from your customs. I must be myself. I cannot break myself any longer for you. If you can love me for what I am, we shall be the happier. If you cannot, I will still seek to deserve that you should. I will not hide my tastes or aversions. I will so trust that what is deep is holy, that I will do strongly before the sun and moon whatever inly rejoices me, and the heart appoints. If you are noble, I will love you; if you are not, I will not hurt you and myself by hypocritical attentions. I fyou are true, but not in the same truth with me, cleave to your companions; I will seek my own. I do this not selfishly, but humbly and truly. It is alike your interest, and mine, and all men's however long we have dwelt in lies, to live in truth. Does this sound harsh today? You will soon love what is dictated by your nature as well as mine, and, if we follow the truth, it will bring us out safe at last.",Ralph Waldo Emerson,Essay on Self-Reliance,4,Book Summary,,,2016-01-01
Q068,"The terror that scares us from self-trust is our consistency; a reverence for our past act or word, because the eyes of others have no other data for computing our orbit than our past acts, and we are loath to disappoint them. But with consistency, a great soul has simply nothing to do.",Ralph Waldo Emerson,Essay on Self-Reliance,5,Consistency,,,2016-01-01
Q069,"Most men have bound their eyes with one or another handkerchief and attached themselves to some one of these communities of opinion. If I know their sect, I anticipate their argument. Nature is not slow to equip us in the prison-uniform of the party to which we adhere.",Ralph Waldo Emerson,Essay on Self-Reliance,5,Religion,,,2016-01-01
Q070,It is easy in the world to live after the world's opinion; it is easy in solitude to live after our own; but the great man is he who in the midst of the crowd keeps with perfect sweetness the independence of solitude.,Ralph Waldo Emerson,Essay on Self-Reliance,5,Belief,,,2016-01-01
Q071,"What I must do is all that concerns me, not what the people think. It is hard, because you will always find those who think they know what is your duty better than you know it.",Ralph Waldo Emerson,Essay on Self-Reliance,5,Independence,,,2016-01-01
Q072,"I do not wish to expiate, but to live. My life is for itself and not for a spectacle. I much prefer that it should be of a lower strain, so it be genuine and equal, than that it should be glittering and unsteady.",Ralph Waldo Emerson,Essay on Self-Reliance,5,Independence,,,2016-01-01
Q073,"Good and bad are but names very readily transferable to that or this; the only right is what is after my constitution, the only wrong what is against it.",Ralph Waldo Emerson,Essay on Self-Reliance,4,Belief,,,2016-01-01
Q074,Whoso would be a man must be a nonconformist. Nothing is at last sacred but the integrity of your own mind.,Ralph Waldo Emerson,Essay on Self-Reliance,4,Belief,,,2016-01-01
Q075,Trust thyself; every heart vibrates to that iron string.,Ralph Waldo Emerson,Essay on Self-Reliance,4,Belief,,,2016-01-01
Q076,"There is a time in every man's education when he arrives at the conviction that envy is ignorance; that immitation is suicide; that he must take himself for better, for worse.",Ralph Waldo Emerson,Essay on Self-Reliance,5,Self-reliance,,,2016-01-01
Q077,"To believe your own thought, to believe that what is true for you in your private heart is true for all men--that is genius.",Ralph Waldo Emerson,Essay on Self-Reliance,5,Belief,,,2016-01-01
Q078,"No man or woman attains a top job, lands an extraordinary deal, or develops a significant following without this heady combination of confidence, poise, and authenticity that convinces the rest of us that we are in the presence of someone who is the real deal.",Sylvia Ann Hewlett,Executive Presence,5,Career,,,2016-01-01
Q079,"My way back to Christianity was not by abstract philosophical reasoning but by experience--experience of the love of God and the presence of the Spirit, as found within the community of the faithful. I didn't reason myself into the faith.",William P. Alston,God and the Philosophers,5,Faith,,,2016-01-01
Q080,"I've come to believe that any serious attempt to cultivate the moral and spiritual dimensions of life will begin to generate and nourish growing suspicions of something more, that something more to which religious faith is both a response and a call.",Thomas V. Morris,God and the Philosophers,4,Faith,,,2016-01-01
Q081,I am a Christian because the deep resources of Christian theology resonate with and make sense of both the contours of my experience and the lineaments of my thoughts.,Thomas V. Morris,God and the Philosophers,4,Religion,,,2016-01-01
Q082,"It is clear to me that it is not just discrete and dramatic, extraordinary experiences of a limited duration and a memorable nature that function in one's coming to have and then both maintaining and maturing in a religious world view--but it seems to me that the job has been done in my own life primarily by a lot of little experiences, insights, intuitions, feelings, adumbrations, and convictions I have sensed forming within myself.",Thomas V. Morris,God and the Philosophers,4,Faith,,,2016-01-01
Q083,I suppose that one of the most persuasive arguments in favor of any religion is its ability to transform the lives of those who practice it.,Laura L. Garcia,God and the Philosophers,5,Character,,,2016-01-01
Q084,A Level 5 leader is an individual who blends extreme personal humility with intense professional will.,Jim Collins,Good to Great,4,Humility,,,2016-01-01
Q085,People and companies that suffer from the curse of competence rarely become great.,Jim Collins,Good to Great,4,Greatness,,,2016-01-01
Q086,"You can accomplish anything in life, provided that you do not mind who gets the credit.",Harry S. Truman,Good to Great,5,Achievement,,,2016-01-01
Q087,"Growing grit takes requires interest, practice, purpose, and hope.",Angela Duckworth,Grit,,Grit,,,2016-01-01
Q088,A growth mindset leads to optimistic self-talk which leads to perseverance over adversity.,Angela Duckworth,Grit,,Growth,,,2016-01-01
Q089,"An explanation of mindfulness by a professor named Michael Baime: 'I was looking up at the sky and the strangest thing happened. I felt like I was actually getting lost in the sky. I felt sort of an opening, like I was becoming much larger. I later found I could make the same thing happen by paying attention to my own thoughts. I became obsessed and do it all the time.'",Angela Duckworth,Grit,,Mindfulness,,,2016-01-01
Q090,"Overtime repression undermines stability and creates new threats, while democracy and respect for human rights create strong and stable societies.",Hillary Clinton,Hard Choices,,Politics,,,2016-01-01
Q091,"Real democracy means that no group or faction or leader can impose their will, their ideology, their religion, their desires on anyone else.",Hillary Clinton,Hard Choices,,Politics,,,2016-01-01
Q092,Most people spend more time planning their summer vacation than planing their lives.,Patricia Fripp,How Successful People Think,3,Goals,,,2016-01-01
Q093,None of us is as smart as all of us.,Ken Blanchard,How Successful People Think,3,Leadership,,,2016-01-01
