ID,Quote,Author,Source,Rating,Tags,Source Type,Notes,Date Added
Q522,"A belief may be comforting. Only through your own experience, however, does it become liberating.",Eckhart Tolle,iPhone,5,Belief,,,2016-01-01
Q523,"Most of what people have to say about God and the higher spiritual worlds has involved bringing them down to our level, rather than elevating our perceptions up to theirs.",Eben Alexander,iPhone,5,God,,,2016-01-01
Q524,Expecting the world to treat you fairly because you are a good person is a little like expecting a bull not to charge at you because you are a vegetarian.,David Wholey,iPhone,5,Adversity,,,2016-01-01
Q525,Looking at small advantages prevents great affairs from being accomplished.,Confucius,iPhone,5,Goals,,,2016-01-01
Q526,"The hearing that is only in the ears is one thing. The hearing in the mind is another. But the hearing of the spirit is not limited to any one faculty, to the ear, or to the mind. Hence it demands the emptiness of all the faculties. And when the faculties are empty, then the whole being listens. There is then a direct grasp of what is right there before you that can never be heard with the ear or understood with the mind.",Chuang-Tzu,iPhone,5,Empathy,,,2016-01-01
Q527,"It is it is Christ himself, not the Bible, who is the true word of God. The Bible, read in the right spirit and with the guidance of good teachers, will bring us to Him.",C.S. Lewis,iPhone,5,Religion,,,2016-01-01
Q528,The pain I feel now is the happiness I felt before.,C.S. Lewis,iPhone,5,nan,,,2016-01-01
Q529,"All you then have to do is to keep out of his mind the question """"If I, being what I am, can consider that I am in some sense a Christian, why should the different vices of those people in the next pew prove that their religion is mere hypocrisy and convention?",C.S. Lewis,iPhone,5,nan,,,2016-01-01
Q530,True humility is not thinking less of yourself; it is thinking less about yourself.,C.S. Lewis,iPhone,5,Humility,,,2016-01-01
Q531,"I believe in Christianity as I believe the sun had risen: not only because I see it, but because by it I see everything else.",C.S. Lewis,iPhone,5,Religion,,,2016-01-01
Q532,"Emotions cycle in and cycle out. The key is to embrace them, but not attach to them. Verbally acknowledge them. Say, this is what anger feels like, this is what sadness feels like, this is what love and happiness feels like.",Buddhist Podcast,iPhone,5,Acceptance,,,2016-01-01
Q533,All that we are is the result of what we have thought.,Buddha,iPhone,5,Character,,,2016-01-01
Q534,Holding on to anger is like grasping a hot coal with the intent of throwing it at someone else; you are the one getting burned.,Buddha,iPhone,5,Anger,,,2016-01-01
Q535,Religion has gone from a belief of faith and mystery to certainty. I'm right you're wrong -- shut up.,Brene Brown,iPhone,5,Religion,,,2016-01-01
Q536,Don't fake it till you make it. Fake it till you become it.,Amy Cuddy,iPhone,5,Perserverence,,,2016-01-01
Q537,I do not like that man. I must get to know him better.,Abraham Lincoln,iPhone,5,Understanding,,,2016-01-01
Q538,I have never had hunger pains sated by a complaint.,David Alan Carlston,Dave's QuoteBook,5,Complaining,,,2016-01-01
Q539,"When we choose not to do something we know we should, we resent those that go on and do it.",David Alan Carlston,Dave's QuoteBook,5,nan,,,2016-01-01
Q540,"Once while in a restaurant, Pablo Picasso was asked by a fan to draw something upon a napkin for him. When the artist finished, the fan asked, """"Great! Now how much would you want for this?"""" Forty dollars, please, replied Picasso.. That much! But it only took you a few moments! Not so my friend. It took my entire lifetime.",David Alan Carlston,Dave's QuoteBook,5,Work,,,2016-01-01
Q541,"Some books are to be tasted, others to be swallowed, and some few to be chewed and digested.",Bacon,Dave's QuoteBook,5,nan,,,2016-01-01
Q542,"We need to turn our mirrors into windows, seeing others and not only ourselves.",David Alan Carlston,Dave's QuoteBook,5,Humility,,,2016-01-01
Q543,"Forgive, forget, and forge ahead.",David Alan Carlston,Dave's QuoteBook,5,Forgiveness,,,2016-01-01
Q544,Maturity is the ability to postpone instant gratification for a greater goal or purpose.,David Alan Carlston,Dave's QuoteBook,5,Discipline,,,2016-01-01
Q545,I have yet to see a referee change a call because of an insult.,David Alan Carlston,Dave's QuoteBook,5,Complaining,,,2016-01-01
Q546,"Sometimes making your point is like hammering a nail; once you've driven it in, additional strokes simply do damage.",David Alan Carlston,Dave's QuoteBook,5,Persuasion,,,2016-01-01
Q547,"One """"Thank you"""" at the right time is all that is needed.",David Alan Carlston,Dave's QuoteBook,5,Gratitude,,,2016-01-01
Q548,Effective leadership begins on the inside and moves out. Only people who genuinely like themselves can build the self-esteem of others without feeling that it takes something away from them.,Ken Blanchard,Dave's QuoteBook,5,Influence,,,2016-01-01
Q549,Choose what you love and love what you choose.,Lao Te Ching,Dave's QuoteBook,5,Love,,,2016-01-01
Q550,"Go as far as you can see and when you get there, you will always be able to see farther.",Zig Ziglar,Dave's QuoteBook,5,Career,,,2016-01-01
Q551,"It's important to our friends to believe that we are unreservedly frank with them, and important to friendship that we are not.",Mignon McLaughlin,Dave's QuoteBook,5,Criticism,,,2016-01-01
Q552,His past was no more to him than the eggshell is to the eagle.,Margaret Deland,Dave's QuoteBook,5,Experience,,,2016-01-01
Q553,"Never regret. If it's good, it's wonderful. If it's bad, it's experience.",Victoria Holt,Dave's QuoteBook,5,Experience,,,2016-01-01
Q554,"Talk often, but never long.",Chesterfield,Dave's QuoteBook,5,Conversation,,,2016-01-01
Q555,"Depend upon it, you will sink or rise to the level of the company which you commonly keep.",Chesterfield,iPhone,5,Character,,,2016-01-01
Q556,A good heart desires rather to conceal than expose other people's weaknesses or misfortunes.,Chesterfield,Dave's QuoteBook,5,nan,,,2016-01-01
Q557,"The more you know, the more modest you should be.",Chesterfield,iPhone,5,Humility,,,2016-01-01
Q558,"Excellencies, if they are real, they will infallibly be discovered, without your pointing them out yourself, and with much more advantage.",Chesterfield,Dave's QuoteBook,5,Pride,,,2016-01-01
Q559,"Endeavor, as much as you can, to keep company with people above you. There you rise, as much as you sink with people below you; for you are whatever the company you keep is.",Chesterfield,Dave's QuoteBook,5,Friends,,,2016-01-01
Q560,"Darkness cannot shut me in again. I have had a glimpse of the shore, and can now live by the hope of reaching it.",Helen Keller,Dave's QuoteBook,5,Mental Health,,,2016-01-01
Q561,"Be slow to give your real friendship, but when you have given it strive to make it lasting; for it is as reprehensible to make many changes in oneâ€™s associates as to have not friends at all. Neither test your friends to your own injury nor be willing to forego a test of your companions.",Isocrates,Dave's QuoteBook,5,Friendship,,,2016-01-01
Q562,A man never likes you so well as when he leaves your company liking himself.,Author Unknown,Dave's QuoteBook,5,Interactions,,,2016-01-01
Q563,Never esteem anything as of advantage to thee that shall make thee break thy word or lose thy self-respect.,Marcus Aurelius,Dave's QuoteBook,5,Integrity,,,2016-01-01
Q564,We must expend energy to have energy.,David Alan Carlston,Dave's QuoteBook,5,Health,,,2016-01-01
Q565,Those who never retract their opinions love themselves more than they love the truth.,Venning,Dave's QuoteBook,5,Pride,,,2016-01-01
Q566,You can have anything you want if you want it desperately enough. You must want it with an exuberance that erupts through the skin and joins the energy that created the world.,Sheila Graham,Dave's QuoteBook,5,Success,,,2016-01-01
Q567,To be happy at home is the ultimate result of all ambition.,Samuel Johnson,Dave's QuoteBook,5,Ambition,,,2016-01-01
Q568,"It is not the number of books you read, nor the variety of sermons you hear, nor the amount of religious conversation in which you mix, but is the frequency and earnestness with which you meditate on these things till the truth in them becomes your own and part of your being, that ensures your growth.",Frederick W. Robertson,Dave's QuoteBook,5,Knowledge,,,2016-01-01
Q569,Nine times out of ten the best thing that can happen to a young man is to be tossed overboard and compelled to sink or swim.,James A. Garfield,Dave's QuoteBook,5,Experience,,,2016-01-01
Q570,"When we are alone, we have our thoughts to watch; in the family, our tempers; and in company, our tongues.",H. More,Dave's QuoteBook,5,Self-control,,,2016-01-01
Q571,Flattery is telling the other person precisely what he thinks about himself.,Author Unknown,Dave's QuoteBook,5,nan,,,2016-01-01
Q572,A great man shows his greatness by the way he treats little men.,Thomas Carlyle,Dave's QuoteBook,5,Greatness,,,2016-01-01
Q573,"In almost any subject, your passion for the subject will save you. If you care enough for a result, you will most certainly attain it. If you wish to be good, you will be good. If you wish to be rich, you will be rich. If you wish to be learned, you will be learned. Only then you must really wish these things and wish them with exclusiveness and not with one hundred other incompatible things just as strongly.",William James,Dave's QuoteBook,5,Goals,,,2016-01-01
Q574,It is better to be controversial for the right reasons than to be popular for the wrong reason.,Shimon Peres,Dave's QuoteBook,5,Conflict,,,2016-01-01
Q575,All of us are as great as the cause we are serving and as small as we limit ourselves to our egos.,Shimon Peres,Dave's QuoteBook,5,Greatness,,,2016-01-01
Q576,"Sell yourself with a sound bite. When people ask, """"What do you do?"""" have an answer that you have prepared in advance that makes them want to know more about you.",Sam Horn,Dave's QuoteBook,5,Conversation,,,2016-01-01
Q577,"To project the confidence you need to, always focus on the other person. It's hard to seem poised when you're worrying about how you look or whether you are saying the right thing. In order to lose this debilitating self-consciousness, focus your attention on others instead of on yourself.",Sam Horn,Dave's QuoteBook,5,Confidence,,,2016-01-01
Q578,How do you build self-discipline? The principle is simple: put off short-term gratification for long-term satisfaction.,Robin S. Sharma,Dave's QuoteBook,5,Discipline,,,2016-01-01
Q579,Discipline is having the courage and the inner strength to stop giving so much time to the unimportant things in your life and to start directing your energy to those high-impact activities which will make a measurable difference in the richness of your life.,Robin S. Sharma,Dave's QuoteBook,5,Discipline,,,2016-01-01
Q580,The best lightning-rod for your protection is your own spine.,Ralph Waldo Emerson,Dave's QuoteBook,5,Confidence,,,2016-01-01
Q581,"When character is present in our relationships, everything else tends to fall into place.",Mike Akin,Dave's QuoteBook,5,Character,,,2016-01-01
Q582,Most of our so-called reasoning consists in finding arguments for going on believing as we already do.,James Harvey Robinson,Dave's QuoteBook,5,Thinking,,,2016-01-01
Q583,"Many people fail to make a favorable impression because they don't listen attentively. They have been so much concerned with what they are going to say next that they do not keep their ears open. Very important people have told me that they prefer good listeners to good talkers, but the ability to listen seems rarer than almost any other good trait.",Isaac F. Marcosson,Dave's QuoteBook,5,Likability,,,2016-01-01
Q584,"Oh, hard! that to fire others, the match itself must needs be wasting!",Herman Melville,Dave's QuoteBook,5,Sacrifice,,,2016-01-01
Q585,Ignorance is the parent of fear.,Herman Melville,Dave's QuoteBook,5,Fear,,,2016-01-01
Q586,"It is not seldom the case in this conventional world of ours... that when a person placed in command over his fellow-men finds one of them to be very significantly his superior in general pride of manhood, straightway against that man he conceives an unconquerable dislike and bitterness; and if he have a chance he will pull down and pulverize that subaltern's tower, and make a little heap of dust of it.",Herman Melville,Dave's QuoteBook,5,Poise,,,2016-01-01
Q587,Think of all insults and criticisms as a series of fishhooks. You have the choice of whether to bite or swim away.,Harold H. Bloomfield,Dave's QuoteBook,5,Criticism,,,2016-01-01
Q588,"I generally like calm, poised people more readily.",David Alan Carlston,Dave's QuoteBook,5,Likability,,,2016-01-01
Q589,"So often when another person asks for advice, the best thing to say is, """"What do you think?",David Alan Carlston,Dave's QuoteBook,5,Advice,,,2016-01-01
Q590,"As a man grows wiser, he talks less and says more.",David Alan Carlston,Dave's QuoteBook,5,Wisdom,,,2016-01-01
Q591,"I have yet to find the man, however exalted his station, who did not do better work and put forth greater effort under a spirit of approval than under a spirit of criticism.",Charles Schwab,Dave's QuoteBook,5,Criticism,,,2016-01-01
Q592,"Think as wise men do, but speak as the common people do.",Aristotle,Dave's QuoteBook,5,Conversation,,,2016-01-01
Q593,"Boss your boss just as soon as you can. There is nothing he will like so well- if he is the right kind of boss. If he is not, he is not the man for you to remain with. Leave him whenever you can, even at a present sacrifice, and find one capable of discerning genius.",Andrew Carnegie,Dave's QuoteBook,5,nan,,,2016-01-01
Q594,Happiness is not something you postpone for the future; it is something you design for the present.,Zig Ziglar,iPhone,4,Happiness,,,2016-01-01
Q595,Readily agreeing with negative feedback is just another form of defensiveness.,Zach Stanford,Zach's Quotebook,4,Feedback,,,2016-01-01
Q596,"Beware of isolating when conversing in a group. All it takes is a simple, yet equally distributed, glance to each person present.",Zach Stanford,Zach's Quotebook,4,Conversation,,,2016-01-01
Q597,The best teacher is the one who is able to take a simple subject and create a profound classroom discussion by asking deeply thought-provoking questions.,Zach Stanford,Zach's Quotebook,4,Teaching,,,2016-01-01
Q598,Being realistic is the most commonly traveled road to mediocrity.,Will Smith,iPhone,4,Dreams,,,2016-01-01
Q599,"Your job should not be the most important thing in your life. The key to a successful and happy life is balance. Your job is part of that balance, but only a part. Make time for your family and friends - and for yourself.",Steve Burke,iPhone,4,Career,,,2016-01-01
Q600,"Trusting your intuition means tuning in as deeply as you can to the energy you feel, following that energy moment to moment, trusting that it will lead you where you want to go and bring you everything you desire.",Shakti Gawain,iPhone,4,Intuition,,,2016-01-01
Q601,"For some people, the longing to be popular far outweighs the longing to be respected, and their social media accounts can verify this.",Paul Hiebert,iPhone,4,Respect,,,2016-01-01
Q602,The best way to have a good idea is to have a lot of ideas.,Linus Pauling,iPhone,4,Creativity,,,2016-01-01
Q603,"If you are drawn to an enlightened teacher, it is because there is already enough presence in you to recognize presence in another. Egos, however, are drawn to false teachers. Darkness cannot recognize light. Only light can recognize light.",Eckhart Tolle,iPhone,4,Countenance,,,2016-01-01
Q604,The homemaker has the ultimate career. All other careers exist for one purpose -- and that is to support the ultimate career.,C.S. Lewis,iPhone,4,nan,,,2016-01-01
Q605,I can't imagine a man really enjoying a book and reading it only once.,C.S. Lewis,iPhone,4,Reading,,,2016-01-01
Q606,"Meditation is used to let go of sensual desires, anger, laziness, restlessness, boredom, and doubt. Once these are let go, the mind is concentrated, and the world is clearer than ever.",Buddhist Podcast,iPhone,4,Meditation,,,2016-01-01
Q607,"The greatest good you can do for another is not just to share your riches, but to reveal to him his own.",Benjamin Disraeli,iPhone,4,Influence,,,2016-01-01
Q608,Nursing grudges is like nursing parasites of the heart.,David Alan Carlston,Dave's QuoteBook,4,Forgiveness,,,2016-01-01
Q609,The first hour of the morning is the rudder of the day.,David Alan Carlston,Dave's QuoteBook,4,nan,,,2016-01-01
Q610,Don't assume a door is closed; you must push on it.,Marian Wright Edelman,Dave's QuoteBook,4,Goals,,,2016-01-01
Q611,"If other people's opinions are more important to you than your own, you are not in charge of your life.",James R. Fisher Jr.,Dave's QuoteBook,4,Independence,,,2016-01-01
Q612,"Failure and defeat and loss afflict us all. Expect it, learn to deal with it.",Les Brown,Dave's QuoteBook,4,Failure,,,2016-01-01
Q613,Life is either a daring adventure or nothing.,Helen Keller,Dave's QuoteBook,4,Courage,,,2016-01-01
Q614,All man's miseries derive from not being able to sit quietly in a room alone.,Blaise Pascal,Dave's QuoteBook,4,Solitude,,,2016-01-01
Q615,Whatever is flexible and flowing will tend to grow; whatever is rigid and blocked will wither and die.,Lao Tzu,Dave's QuoteBook,4,Growth,,,2016-01-01
Q616,"Success is measured by contribution, not acquisition.",William Halamandaris,Dave's QuoteBook,4,Success,,,2016-01-01
Q617,"We show respect by being courteous, listening attentively, and maintaining eye contact, as well as by avoiding giving advice, lecturing, and using a condescending tone.",Kathy Indermill,Dave's QuoteBook,4,Listening,,,2016-01-01
Q618,"I challenge you to be great. To be great is to have character, integrity, and be true to noble principles.",James E. Faust,Dave's QuoteBook,4,Character,,,2016-01-01
Q619,Private choices are not private; they all have public consequences... Our society is the sum total of what millions of individuals do in their private lives. The sum total of private behavior has worldwide public consequences of enormous magnitude. There are no completely private choices.,James E. Faust,Dave's QuoteBook,4,Influence,,,2016-01-01
Q620,"If you have made mistakes, even serious ones, there is always another chance for you. What we call failure is not the falling down, but the staying down.",Mary Pickford,Dave's QuoteBook,4,Failure,,,2016-01-01
Q621,Forethought spares afterthought.,Amelia E. Barr,Dave's QuoteBook,4,Prudence,,,2016-01-01
Q622,Forgiveness is the act of admitting we are like other people.,Christina Baldwin,Dave's QuoteBook,4,Forgiveness,,,2016-01-01
Q623,You can't have genius without patience.,Margaret Deland,Dave's QuoteBook,4,Patience,,,2016-01-01
Q624,"To save the mind from preying inwardly upon itself, it must be encouraged to some outward pursuit. There is no other way to elude apathy, or escape discontent; none other to guard the temper from that quarrel with itself, which ultimately ends in quarreling with all mankind.",Fanny Burney,Dave's QuoteBook,4,Worry,,,2016-01-01
Q625,It is almost impossible to throw dirt on someone without getting a little on yourself.,Abigail Van Buren,Dave's QuoteBook,4,nan,,,2016-01-01
Q626,"No matter how brilliantly an idea is stated, we will not really be moved unless we have already half-thought of it ourselves.",Mignon McLaughlin,Dave's QuoteBook,4,Persuasion,,,2016-01-01
Q627,"A mistake in judgment isn't fatal, but too much anxiety about a decision is.",Pauline Kael,Dave's QuoteBook,4,Decisions,,,2016-01-01
Q628,Where there is laughter there is always more health than sickness.,Phyllis Bottome,Dave's QuoteBook,4,Health,,,2016-01-01
Q629,"People who know how to employ themselves, always find leisure moments, while those who do nothing are forever in a hurry.",Marie-Jeanne Roland,Dave's QuoteBook,4,nan,,,2016-01-01
Q630,A letter is a risky thing; the writer gambles on the reader's frame of mind.,Margaret Deland,Dave's QuoteBook,4,Communication,,,2016-01-01
Q631,There is no place in the world where courtesy is so necessary as in the home.,Helen Hathaway,Dave's QuoteBook,4,Family,,,2016-01-01
Q632,No one would remember the Good Samaritan if he'd only had good intentions. He had money as well.,Margaret Thatcher,Dave's QuoteBook,4,Influence,,,2016-01-01
Q633,Friends and good manners will carry you where money won't go.,Margaret Walker,Dave's QuoteBook,4,Friends,,,2016-01-01
Q634,"The farther behind I leave the past, the closer I am to forging my own character.",Isabelle Eberhardt,Dave's QuoteBook,4,Self-improvement,,,2016-01-01
Q635,"I think perfectionism is based on the obsessive belief that if you run carefully enough, hitting each steppin-stone just right, you won't have to die. The truth is that you will die anyway and that a lot of people who aren't even looking at their feet are going to do a whole lot better than you, and have a lot more fun while they're doing it.",Anne Lamott,Dave's QuoteBook,4,Fear,,,2016-01-01
Q636,Dwelling on the negative simply contributes to its power.,Shirley MacLaine,Dave's QuoteBook,4,Worry,,,2016-01-01
Q637,All things a man owns hold him far more than he holds them.,Sigrid Undset,Dave's QuoteBook,4,Money,,,2016-01-01
Q638,Nothing contributes so much to tranquilize the mind as a steady purpose-a point on which the soul may fix its intellectual eye.,Mary Shelley,Dave's QuoteBook,4,Action,,,2016-01-01
Q639,The power to question is the basis of all human progress.,Indira Gandhi,Dave's QuoteBook,4,nan,,,2016-01-01
Q640,"The more you kick something that's dead, the worse it smells.",Barbara Stanwyck,Dave's QuoteBook,4,Complaining,,,2016-01-01
Q641,The bitterest tears shed over graves are for words left unsaid and deeds left undone.,Christopher Crowfield,Dave's QuoteBook,4,Gratitude,,,2016-01-01
Q642,One can never consent to creep when one feels an impulse to soar.,Helen Keller,Dave's QuoteBook,4,Ambition,,,2016-01-01
Q643,The world never puts a price on you higher than the one you put on yourself.,Sonja Henie,Dave's QuoteBook,4,Confidence,,,2016-01-01
Q644,To be criticised is not necessarily to be wrong.,Sir Anthony Eden,Dave's QuoteBook,4,Criticism,,,2016-01-01
Q645,The Peter Principle: In a hierarchy every employee tends to rise to his level of incompetence.,Lawrence J. Peter,Dave's QuoteBook,4,Career,,,2016-01-01
Q646,The things that a man does not say often reveal the understanding and penetration of his mind even more than the things he says.,Robert A. Milikan,Dave's QuoteBook,4,Reputation,,,2016-01-01
Q647,"Of course, sometimes it is not possible to prepare an address fully, but it is much better to do so even if you intend to speak extemporaneously.",Robert A. Taft,Dave's QuoteBook,4,Speaking,,,2016-01-01
Q648,Happiness is beneficial for the body but it is grief that develops the powers of the mind.,Marcel Proust,Dave's QuoteBook,4,Experience,,,2016-01-01
Q649,"People don't ask for facts in making up their minds. They would rather have one good, soul-satisfying emotion than a dozen facts.",Robert Keith Levitt,Dave's QuoteBook,4,Decisions,,,2016-01-01
Q650,It is the heart which makes men eloquent.,Latin proverb,Dave's QuoteBook,4,Authenticity,,,2016-01-01
Q651,He gives twice who gives quickly.,Latin proverb,Dave's QuoteBook,4,Service,,,2016-01-01
Q652,"Boldness has genius, power, and magic in it.",Goethe,Dave's QuoteBook,4,Confidence,,,2016-01-01
Q653,"Laziness grows on people; it begins in cobwebs and ends in iron chains. The more business a man has to do the more he is able to accomplish, for he learns to economize his time.",Sir M. Hale,Dave's QuoteBook,4,nan,,,2016-01-01
Q654,Judge of a man by his questions rather than by his answers.,Voltaire,Dave's QuoteBook,4,Thinking,,,2016-01-01
Q655,"My riches consist not in the extent of my possessions, but in the fewness of my wants.",J. Brotherton,Dave's QuoteBook,4,Money,,,2016-01-01
Q656,"In taking revenge a man is but equal to his enemy, but in passing it over he is his superior.",Bacon,Dave's QuoteBook,4,Forgiveness,,,2016-01-01
Q657,Apt to promise is apt to forget.,Thomas Fuller,Dave's QuoteBook,4,nan,,,2016-01-01
Q658,"It is only imperfection that complains of what is imperfect. The more perfect we are, the more gentle and quiet we become toward the defects of others.",Fenelon,Dave's QuoteBook,4,Perfection,,,2016-01-01
Q659,"Patience is bitter, but its fruit is sweet.",Rousseau,Dave's QuoteBook,4,Patience,,,2016-01-01
Q660,"Luxury makes a man so soft, that it is hard to please him, and easy to trouble him; so that his pleasures at last become his burden. Luxury is a nice master, hard to be pleased.",Mackenzie,Dave's QuoteBook,4,Work,,,2016-01-01
Q661,"To be rich in admiration and free from envy; to rejoice greatly in the good of others; to love with such generosity of heart that your love is still a dear possession in absence or unkindnessâ€”these are the gifts of fortune which money cannot buy and without which money can buy nothing. He who has such a treasury of riches, being happy and valiant himself, in his own nature, will enjoy the universe as if it were his own estate; and help the man to whom he lends a hand to enjoy it with him.",Robert Louis Stevenson,Dave's QuoteBook,4,Wealth,,,2016-01-01
Q662,"It is wise to be sure, but otherwise to be too sure.",Sophi Irene Loeb,Dave's QuoteBook,4,Belief,,,2016-01-01
Q663,"Like water which can clearly mirror the sky and the trees only so long as its surface is undisturbed, the mind can only reflect the true image of the self when it is tranquil and wholly relaxed.",Indra Devi,Dave's QuoteBook,4,Introspection,,,2016-01-01
